{
  "schema": "fcmo-newsroom-status-v2",
  "status_updated_at": "2026-09-26T20:00:00Z",
  "edition_state": "DELAYED",
  "edition_reason": "ARB_MAIN_RED",
  "wire_state": "DELAYED:ARB_MAIN_RED",
  "wire_run_at": "2026-09-26T19:52:00Z",
  "edition_date": "2026-09-26",
  "last_edition_at": "2026-09-23T11:32:15Z",
  "quiet_since": null,
  "release_id": "newswire-20c466f170839ac07e07bb80",
  "corpus_digest": "20c466f170839ac07e07bb80f0ffbcbe7385972f854587b4a918fbf0a5ee45cb",
  "live_story_count": 43,
  "translation": {
    "es-419": {
      "complete": 4,
      "pending": 39,
      "failed": 0
    },
    "zh-Hans": {
      "complete": 4,
      "pending": 39,
      "failed": 0
    }
  },
  "drill": null,
  "alerts": [
    "ARB_MAIN_RED"
  ]
}
